{
  "schemaVersion": "v1",
  "datasetId": "dataset_feed_replay_sol_usdc_market_events",
  "snapshotId": "snapshot_2026_03_07_seed",
  "datasetKind": "market_events",
  "normalizationKind": "replay_ready",
  "format": "fixture_json",
  "retentionClass": "seed",
  "capturedAt": "2026-03-10T00:00:00.000Z",
  "coverageStartAt": "2026-03-07T00:00:00Z",
  "coverageEndAt": "2026-03-07T00:00:05Z",
  "rowCount": 2,
  "venueKeys": ["jupiter"],
  "assetKeys": ["SOL", "USDC"],
  "pairSymbols": ["SOL/USDC"],
  "chainKeys": ["solana-mainnet"],
  "uri": "repo://services/runtime-rs/fixtures/runtime-feed-replay.sol_usdc.v1.json#marketEvents",
  "contentDigest": "sha256:fixture",
  "provenance": {
    "acquisitionKind": "research_fixture",
    "collectedFrom": "services/runtime-rs/fixtures/runtime-feed-replay.sol_usdc.v1.json",
    "provider": "repo-fixture",
    "collectedAt": "2026-03-10T00:00:00.000Z",
    "generator": "runtime-rs",
    "generatorRevision": "feed-replay-seed-v1",
    "notes": "Seeded from deterministic market events slice."
  },
  "samplingNotes": "Complete deterministic fixture coverage.",
  "compactionNotes": "No compaction applied to the fixture seed.",
  "tags": ["seed", "deterministic", "replay"],
  "notes": "Seed dataset snapshot for runtime feed replay market events."
}
